text,label,potty training,other,walk training,economy,child milestones,childcare,school,child product,mom health,discipline,baby food,child behavior problem,sinle parents,child health,sleeping,pregnancy,parent-child interaction,language training,parent education,emotion coaching,dad parenting,breastfeeding,play,sell exchange,parent support,non-biological parents,multiple children,child appearances,working parents,birth,aug
"Anyone's kiddo eating Enfamil Reguline? I have a big stack of coupons for $2.50 off- but they only apply to the Reguline, not any other Enfamil Products. I'm not sure if they can be stacked with Enfamil checks, probably depends on the store.\n\nIt's great for constipation and other tummy issues http://www.enfamil.com/products/solutions-feeding-issues/enfamil-reguline\n\n\nI'm happy to send them along to anyone who can use them!\n",1,False,False,False,True,False,False,False,True,False,False,False,False,False,False,False,False,False,False,False,False,False,False,False,False,False,False,False,False,False,False,"""Anyone eat Enfamil Reguline?"" I have a big stack of coupons costing $2.50 - but they apply only to Enfamily products, not to others. I'm not sure whether they can be stacked with Enfamil cheques probably depends on the shop.\ n\ nIt's great for constipation and other stomach problems. http: / / www.enfamil.com / products / solutions-feeding-issues / enfamil-reguline-n\ nI'll be happy to send them to anyone who can use them on!\ n"
"We were given a set as a gift but don't need them. Can anyone use them? They are just basic, but a baby monitor is a bay monitor. ",1,False,False,False,False,False,False,False,False,False,False,False,False,False,False,False,False,False,False,False,False,False,False,False,True,False,False,False,False,False,False,"We got a set as a gift, but we don't need it. Can anyone use it? It's just simple but a baby monitor is a Bay monitor."
"My husband and I have received a TON of clothes from family and friends. All are gently used, but in good condition. We recently sorted through them and came up with a lot that aren't really our style..Some are very dressy and some are just play clothes. If you need some clothes for your little dude, let me know and I'll send a pic of what we have, if you see something you like, let me know and maybe we can trade (I have a two month old son) or figure something else out!",1,False,False,False,False,False,False,False,False,False,False,False,False,False,False,False,False,False,False,False,False,False,False,False,True,False,False,False,False,False,False,"My husband and I have received a ONE TONE of clothes from family and friends - all are softly used but in good condition. We have searched them recently and come up with lots of things that are not really our style. Some are very stylish and some are just toys. If you need clothes for your little guy, let me know and I'll send you a pic of what we have, in case you see something that you like let me know and maybe we can swap (I have a two months old son) or find something else!"
"When we went for a quick visit a month before they're going to start, the teacher told us how at 18 months kids are really ready, and you should just put them in underwear.  When they have an accident they will supposedly not like it, and will learn to start using the toilet.  To be fair, all the kids in their 2-3 class are potty trained within a couple weeks.  And they are all well behaved, and don't seem to have any 'issues' because of it.\n\nWe like the pre-school otherwise but this seems a bit extreme.  Anyone else have an experience like this?  ",1,True,False,False,False,False,False,False,False,False,False,False,False,False,False,False,False,False,False,False,False,False,False,False,False,False,False,False,False,False,False,"When we went on a short break a month before the start, Micky told us that at 18 months old the teacher was ready and she was supposed to be forced to put her in her underwear. If they had an accident, they probably wouldn't like it and so they started to learn to use the toilet. To be fair, all the children in their 2nd-3rd grades are completely potty trained and they all are well behaved and don't seem to have any ""problems"" with it.\ n\ nWe like pre-school but that seems a little extreme."
"Those who use rice cereal formulas.... Due to WAY excessive spit up, ped recommended we start solids (rice cereal) and said we could also consider Enfamil AR (added rice) formula. It worked like magic! Barely any spit up anymore.\n\nWe do cereal 2x/day and have been doing 50/50 or 60/40 AR/Gentlease. For those that use rice cereals... did you move to 100% rice cereal...? Only use it sometimes? \n\nI'm trying to figure out if we should be moving him off the Gentlease and towards wholly AR, or stay with a 50/50 type mix, or use AR at night and Gentlease during the day, or Gentlease when he gets cereal and AR when he just has a bottle... etc! Too many choices. LOL\n\nAny advice? Thank you! ",1,False,False,False,False,False,False,False,False,False,False,True,False,False,False,False,False,False,False,False,False,False,False,False,False,False,False,False,False,False,False,"Those who use rice grain formulas.... Because of excessive spitting out ped recommended to start solids (rice cereals) and said we could also consider Enfamil AR (additional rice) formula. It works like a magic! Hardly spitting anymore!\ n\ nWe make cereals twice a day and do 50 / 50 or 60 / 40 AR / Gentlease. Those who use rice cereals... did you move to 100% rice cereal...? Only use it sometimes?\ n\ nI try to figure out if we should move it out of the Gentlease towards the whole AR, or stick with a 50 / 50 type mixture or use AR during the day and Gentlease, or Gentlease if it gets cereal and AR if it only has one bottle"
"Lately my grovia hook and loops diapers have been leaking out the front top. Like where the flaps comes around the front it just soaks through quicker than before. I have a boy and I put the wider end of the insert towards the back, should I put the wider part in front? That seems like it may help but the insert is squished between his legs anyway so I\u2019m not sure. He is about 15lbs and wears size 2 in disposables, I just made the front snaps to the bigger size to see if it helps. Anybody have any other suggestions?",1,False,False,False,False,False,False,False,True,False,False,False,False,False,False,False,False,False,False,False,False,False,False,False,False,False,False,False,False,False,False,"My groin loop eyelets diaper recently leached out of the front panel. As anywhere with tablets running around the front panel, it just sucks faster than before. I have a boy and put the broader end of the insert backwards, should I use the broader of the insert on the front panel? That seems to help but the insert is squeezed between the legs anyway and that's why I'm not sure it works. He weighs about 15lbs and wears size 2 disposable Alaska, I just pushed the front panel to the larger one size to see if it helps."
"So, we're about six weeks in and just had my wife's doctor confirm the pregnancy.  Her parents know and we're going to tell my mom and sister.  But, when did ya'll start making big announcements!?  What time is appropriate?",1,False,False,False,False,False,False,False,False,False,False,False,False,False,False,False,True,False,False,False,False,False,False,False,False,False,False,False,False,False,False,"s doctor confirm the pregnancy, her parents know and we'll tell my mum and sister. But when did you start making big announcements!? What's the appropriate time?"
"It is a Medela Pump in Style Advanced tote. It was only used for about a month and I have pictures of it but baby is hollering so I can post later if anyone is even interested in it. It comes with (if I remember right) 225 milk storage bags as well as sterilizing bags and all that comes with it new. If anyone is interested, please pm me. I am happy to work out a deal :) ",1,False,False,False,False,False,False,False,False,False,False,False,False,False,False,False,False,False,False,False,False,False,True,False,True,False,False,False,False,False,False,"It's a Medela pump in style advanced bag. It's only been in use for about a month and I have pictures, but baby is buzzing so I will be able to post a message later if anybody is interested. It comes (if I remember correctly) with 225 milk bags and sterilisation bags and everything it entails new."
"BS broke his little plastic accordion that he was enjoying (he's musically inclined).  Me and SO immediately thought it would be cool to get him a real accordion for xmas.  BM emailed later that evening if I wanted to go in with her, and her dad who has been looking for a gift to give, to get a real accordion ($500!).  Brought this up with SO and she thinks BM is just being manipulative and should just get it if she wants to get it.  But I want to be a part of that gift.  I think BM is more being practical.  Planning on getting BD an instrument as well, so maybe that's a compromise?  SO is frustrated and that makes me frustrated.  Anybody had anything like this?  ",1,False,False,False,False,False,False,False,True,False,False,False,False,False,False,False,False,False,False,False,False,False,False,False,False,False,False,False,False,False,False,"BS broke his little plastic accordion, which he just enjoyed (he is musically inclined) and it was so cool to get him a real accordion for Christmas. BM wrote an email later that evening if I wanted to get it ($500!) with her and her father who was looking for a present. BM brought this up with SO, and she thinks BM is just manipulative Theodore and should only get it if she wants to. I, however, would like to be a part of it. I think BM is more practical. It is also planned to get an instrument BD, so maybe that is a compromise? SO frustrated and it makes me mieren. Somebody had something like that?"
"My hubby and I have an adorable 4 week old. And he wanted to know when she will start ""playing""? For example: bating at toys, shaking rattles. Right now her playtime consists of: us trying to calm her down, looking at faces/a mirror, and crying through tummy time.\n\nSo r/NewParents when did your little ones start to ""play""?",1,False,False,False,False,True,False,False,False,False,False,False,False,False,False,False,False,False,False,False,False,False,False,True,False,False,False,False,False,False,False,"My husband and I have a lovely 4 week old daughter. And I wanted to know when she would start to ""play,"" for example: touch toys, shake rattles. At the moment her time is: trying to calm her, see faces / mirror and cry through her belly tone time.\ n SourceparentWhen did your kids start ""playing""?"
"How old was your baby when you first introduced squeeze pouches? How long did it take them to figure out how to eat from them? \n\nI bought some refillable pouches for my LO (9 months) so that she could hopefully start feeding breakfast smoothies to herself. I know she likes the taste of the smoothies, because she'll eat toast or a waffle that's dipped in them, but she doesn't like to be spoon fed (she tries to grab food off the spoon and put it in her mouth by herself; doesn't work with liquid). We've tried the pouches three times so far. The first two times she took the pouch from me and emptied it out onto her tray, but would let me put the opening in her mouth and squeeze out a little food for her. The third time she did not want the pouch to go anywhere near her mouth. \n\nDoes anyone have any suggestions about how to get her to use them? She'll drink from a sippy cup (munchkin 360) but smoothies are too thick for the cup. Should I keep trying, or is this a sign she's not ready for the pouches yet?",1,False,False,False,False,False,False,False,False,False,False,True,False,False,False,False,False,False,False,False,False,False,False,False,False,False,False,False,False,False,False,"How old was your little one, song of the Pouch? How long did she take to figure out how to eat out? · n\ nI bought myself a couple of refillable pouches for my LO (9 month) so hopefully she can start feeding herself smoothies for breakfast. I know she likes the taste of smoothies because she will eat toast or a waffle dipped in them but she doesn't want to be fed (she reaches for food and puts it in her mouth, not with liquid) .We tried the pouches three times."
"Baby is 5 weeks old and I have amassed a freezer stash of 70 ounces. Due to small freezer space, I was thinking of donating this milk to the local milk bank. Then as time goes on, donating on a monthly basis to reset my freezer stock with ""fresh"" milk and to ensure the milk I donate doesn't defrost accidentally or get freezer burn.\n\nI love the idea of donating my milk however the only thing giving me pause is what if something happens to me and I donate away all that milk my baby could use? How big of a stash is ""good"" to have? I go back to work in a month, so I have plenty of time to build it back up.\n\nBasically, I need someone to tell me to stop being stupid and donate the milk. Lol",1,False,False,False,False,False,False,False,False,False,False,False,False,False,False,False,False,False,False,False,False,False,True,False,False,False,False,False,False,False,False,"Baby is 5 weeks old and I have amassed a 70 ounce freezer. Through the tiny freezer, I thought about donating that milk to the local milk bank.\ n\ nI wanna donate monthly to refrigerate my freezer with ""fresh"" milk to make sure the milk I give is not accidentally thawed or freezer burnt.\ n\ nI love the idea of donating my milk, but the only thing that will give me pause is what happens if something happens to me and I donate everything that my child needs? How large is a stash to have a good one? I go back to work in a month so I have enough time to rebuild. ¹ I have to tell myself to stop being stupid and donate the milk."
"My daughter is an only child and just turned 3. We had some luck with potty training around 6 months ago, but she was constipated a little and seemed to be uncomfortable with going. She has since regressed. When we try to sit her on the potty she freaks out. When we suggest it at all she simply says no.  Our sitter has a 4 year old that goes to preschool and we have tried to use that as ""hey if you want to be a big girl and go to school you have to use the potty"". \n\nWe have tried everything. Our sitter is incredibly supportive with 3 kids but our daughter just has no interest in it. I feel like I am failing her by her not progressing.",1,True,False,False,False,False,False,False,False,False,False,False,False,False,False,False,False,False,False,False,False,False,False,False,False,False,False,False,False,False,False,"My daughter is an only child and has just turned 3. About six months ago we were lucky with potty training, but she was a bit congested and obviously had trouble walking. She's been declining ever since. When we try to sit her on the potty she freezes and when we even suggest it she says no. Our minder has a 4 year old son going to kindergarten and we tried to use it as a ""Hey, if you want to be a big girl and you go to school you have to use the potty.""\ n\ nWe tried everything. Our caregiver is incredibly supportive with 3 children, but our daughter just has no interest - I feel like she's going to fail because she's not moving forward."
"I don\u2019t why I\u2019m so upset today, but I feel like a horrible person for getting a divorce from my ex wife last year, as my daughter is only two.  As she sings the song from Frozen, I\u2019m balling my eyes out thinking I\u2019ve robbed this toddler a two parent household and what could\u2019ve been a brother and sister one day.  I hope this is normal and one day it will pass. ",1,False,False,False,False,False,False,False,False,False,False,False,False,True,False,False,False,False,False,False,False,False,False,False,False,False,False,False,False,False,False,"I don't know why I got so excited today, but I feel like a terrible person because I got a divorce from my ex-wife last year because my daughter is only two years old. As she sings the song from Frozen, I think with confused eyes, that I stole a baby from a two-parent household and what could be a sibling one day. I hope that is normal and that one day it will pass."
"My darling daughter will now sit on the potty, but refuses to do anything.  We will just finish up sitting, and not even 5 minutes later she'll pee her pants.\n\nWe've downloaded the app about helping animals to the potty, and use the Pepi app.  We have used stickers, colouring books, and other resources, and still reward her for sitting on the potty (1 smartie).  \n\nI'm not sure how else to engage her to pee on the toilet.  She has severe eczema, and every time she pees herself, she cries because of the open wounds.  We've talked about peeing in the potty feeling nice... anyway, thoughts??",1,True,False,False,False,False,False,False,False,False,False,False,False,False,False,False,False,False,False,False,False,False,False,False,False,False,False,False,False,False,False,"I'm not sure how to get her to pee on the toilet yet, she has severe eczema, and every time she pees she cries because of the open wounds. We've talked about it and it feels good... Shall we have thoughts??"
"As my husband was making them lunch one day (first or second week after their arrival) the new toddler, ""Ruby"",was hugging my husband's legs. My daughter (Lilith) goes up to them and gently pushes Ruby away from my husband. As she's pushing Ruby away from him she says, ""No. Go. I sorry. My Daddy. I sorry, my Daddy.""",1,False,False,False,False,False,False,False,False,False,False,False,False,False,False,False,False,True,False,False,False,False,False,False,False,False,False,False,False,False,False,"While my husband was preparing her lunch one day (the first or second week after she arrived), the new toddler ""Ruby"" embraced my husband's legs. My daughter (Lilith) walks up to them and gently pushes Ruby away from my husband. When she pushes Ruby away from him, she says: ""No. Go. I'm sorry. My dad. I'm sorry, my dad."""
"I've been staying at home with him since he was almost 2 months old, and unfortunately -- due to weather, overattention from grandparents, sloth, what have you -- we have not really made social inroads with other parents and infants.\n\nI'd like to get out and meet people to socialize him (and me, who is going stir crazy) and there are a few groups in my area for that. But I can't help worrying that I'll show up and everyone will have kids who already walk around and, y'know, do stuff. I need to find a group of other parents who have kids very much the same age.\n\nSo I guess I'm asking, where do all the SAHPs take their 6-month-olds during the day when it's not nice weather?",1,False,False,False,False,False,False,False,False,False,False,False,False,False,False,False,False,False,False,False,False,False,False,True,False,True,False,False,False,False,False,"I've been staying at your house since he was 2 months old and unfortunately we didn't get a social connection with other parents and toddlers.\ n\ nI'd like to go out and meet people to get to know him (and even me, who drive him mad) and there's a few groups in my area for that.\ n\ nBut I can't help but worry that I will come and that everyone will have kids that're already running around doing, you know, stuff. I have to find a group of other parents that have kids the same age.\ n\ nSo I wonder where all these SAHPs take their 6-month-old kids a day, if it's not beautiful?"
"Hi everyone, \n20 weeks pregnant with di/di twin boys, excited and terrified in equal measures. Current preoccupation is how our couple is going to survive this - I just read that 1 out of every 3 coupes with twins divorce... we have a good relationship but it gets extremely strained when it comes to childcare and when we're sleep deprived, so basically the next two years of our lives! Do you have any tips or advice for us so we can be better prepared?\n\nEdit: thank you for all your amazing replies. I think I will be coming back to these messages again and again over the next years. You're all amazing! ",1,False,False,False,False,False,False,False,False,False,False,False,False,False,False,False,False,False,False,False,False,False,False,False,False,True,False,True,False,False,False,"I'd like to thank all the people who are 20 weeks pregnant with twin boys, excited and scared right now. We currently worry how our couple will survive this - I just read that 1 out of 3 couples get divorced... We have a good relationship, but it gets extremely tense when it comes to child care and when we lack sleep - basically the next two years of our lives! Do you have any gesungen or advice for us to be better prepared?"
"So, I embarassed to ask this 8 months into cloth diapering my second kid. But. We\u2019re finally taking the leap and using cloth wipes.\n\nDumb Question- what to do with poop wipes? Do we just spray them like we spray poop diapers? Isn\u2019t that tedious AF to spray little wipes? Am I being ridiculous?",1,True,False,False,False,False,False,False,False,False,False,False,False,False,False,False,False,False,False,False,False,False,False,False,False,False,False,False,False,False,False,"But then we finally take the plunge, using linen wipes.\ n\ nStupid question: What to do with wipes? Do we just spray them away like diapers? Is it not the tedious AF to spray small wipes? Would I be ridiculous?"
Was pregnant last summer and have no need for my maternity clothes. Hoping to pass them off to others. Asking $5 per item +shipping . Prices are negotiable if you are interested in more than 1 item. \n\nAlbum is here:   http://imgur.com/a/qLGLw,1,False,False,False,False,False,False,False,False,False,False,False,False,False,False,False,False,False,False,False,False,False,False,False,True,False,False,False,False,False,False,Was pregnant last summer and do not have a need for my maternity clothes. Hoping to pass them on to ask for 5 dollars apiece + shipping. Prices are negotiable if you are interested in more than one piece.\ n\ nAlbum here: http: / / imgur.com / a / qLGLw
"Oh my goodness! I know people say breastfeeding is hard, but I feel like I have to be doing something wrong. My LO is just shy of 4 months old and I feel like I still know nothing about BF. I am a SAHM/WAHM mom. She is gaining weight (slow but sure) and I feel like her diaper output is enough but I feel like feeding her is such a struggle. We do an eat play sleep cycle with her and each and every time I feed her, it is so hard to get her to feed 10 mins total. She pulls off so many times when I\u2019m feeding her and when I try to put her back on, she just fusses. It can be so frustrating!! I just don\u2019t know why she pulls off so much! Any ideas or suggestions would be greatly appreciated. ",1,False,False,False,False,False,False,False,False,False,False,False,False,False,False,False,False,False,False,False,False,False,True,False,False,False,False,False,False,False,False,"My LO is only 4 months old and I feel like I don't know anything about BF. I am a SAHM / TRUE mother. She is gaining weight (slowly but surely) and I feel that her diaper diaper output is enough, but I feel like I'm feeding her alone. We go on a eating sleep phase with her, and every time I feed her, it is so difficult to get her to feed her for 10 minutes. She undresses so often when I feed her and when I try to put her back on she just falls off. It can be so frustrating!! I just don't know why she is pulling so much! Any ideas or suggestions would be greatly appreciated."
Greetings;\n\nSo with the news that my wife is expecting twins comes the realization that my little [Nissan Versa will not be enough anymore](https://indigocarhire.co.uk/wp-content/uploads/2012/09/hire-car-too-small-300x266.jpg). \n\nDo I bite the bullet and get a Mini Van ? Or are there better options ?\n\nWhat brand and model do you have and would recommend for twins. !!\n\nRegards.,1,False,True,False,False,False,False,False,True,False,False,False,False,False,False,False,False,False,False,False,False,False,False,False,False,False,False,False,False,False,False,"greetings;\ n\ nWith the news that my wife is expecting twins, I realised that my little [Nissan Versa will no longer be sufficient] (https: / / indigocarhire.co.uk / wp-content / uploads / 2012 / 09 / rental-car-too-small-300x266.jpg).\ n\ nI bit the bullet and put on a Mini Van? Or are there better options?\ n\ nWhich make and model are you even considering and are you recommending for twins.!!"
I tried doing some Google searches for an answer to this but I couldn't really find anything.  But does anyone know if the canvas materials that shade the baby in strollers and infant car seat carriers will block harmful rays from the sun?  We have the chicco next fit travel system.  \n\nTo be in the safe side we've picked up some sunscreen for the baby to use as well as the shades on the stroller/carseat.,1,False,False,False,False,False,False,False,True,False,False,False,False,False,False,False,False,False,False,False,False,False,False,False,False,False,False,False,False,False,False,"I have been doing a few Google searches to find an answer, but I couldn't really find anything. However, does anyone know if the linen fabric that shades the baby in strollers and baby boos keeps out harmful rays from the sun? We have the Chicco Next Fit Travel System.\ n\ nTo play it safe, we have used sunscreen for the baby and sunscreens for the stroller."
