text,label,potty training,other,walk training,economy,child milestones,childcare,school,child product,mom health,discipline,baby food,child behavior problem,sinle parents,child health,sleeping,pregnancy,parent-child interaction,language training,parent education,emotion coaching,dad parenting,breastfeeding,play,sell exchange,parent support,non-biological parents,multiple children,child appearances,working parents,birth,aug
So I participated in the survey re: exclusive pumping.  Yesterday in 24 hours I pumped 2:15 minutes and collected a total of 1155mL which is just over 39oz.  Anyone else have figures to compare.,1,False,False,False,False,False,False,False,False,False,False,False,False,False,False,False,False,False,False,False,False,False,True,False,False,False,False,False,False,False,False,"So I took part in the survey re: exclusive pumps. Yesterday pumped in 24 hours 2: 15 minutes and collected a total of 1155ml, which is just over 39 ounces. Everyone else has figures to compare."
"I've started researching what pumps my insurance will cover (thank you Obama!) and one of the medical suppliers carries five different brands.\n\nOne is the Limerick PJ's Comfort Pump. It's a hospital grade pump.\n\nDoes anyone use one, or have feedback on it?\n\nThey also have the Medela Advanced Personal (which I think is the same as the In Style?)\n\nThanks ladies!",1,False,False,False,False,False,False,False,False,False,False,False,False,False,False,False,False,False,False,False,False,False,True,False,False,False,False,False,False,False,False,Hello woman! I started researching what pumps my insurance will cover (thank you Obama!) and one of the medical providers carries five different brands.\ n\ nOne is the Limerick Comfort Pump from PJ. This is a hospital pump.\ n\ nHas any one used or feedback on this?\ n\ nYou also have the Medela Advanced staff (which in my opinion is the equivalent of In Style?)\ n\ nThank you ladies!
"About a week ago, my 2 1/2 year old started complaining about hip pains, which happens every single growth spurt. So, we've got about a week or two to restock her closet. Holy crap does this kid grow fast!\n\nWe're looking for 2T dresses/shirts/tops/pants/shorts/leggings, size 5/6 shoes/sandals/dress shoes (no heels, please). She is definitely a girly girl, loves her dresses. She's not super keen on pink, but she loves her purples, yellows and greens. She's slender and tall, too. Certainly, we are well accepting of second hand clothes.\n\nWe're in a little bit of financial distress, and can't really afford much. Hopefully, things will be sorted out soon. In a couple weeks time, I'll probably be posting an offer to ship out Aria's 18-24 month clothes (assuming we can get her wardrobe replaced in that time). \n\nAny help is always much appreciated, thank you! \n\n*Edit: We're in Denver, Colorado.*",1,False,False,False,True,False,False,False,True,False,False,False,False,False,False,False,False,False,False,False,False,False,False,False,False,False,False,False,False,False,False,"A week ago, my 2-1 / 2 year old child complained of hip pain which is hurting any growth surge, so we will have about a week or two in front of her closet. Holy crap this baby is growing faster!\ n\ nWe are looking for 2T dresses / t-shirts / tops / trousers / shorts / leggings, size 5 / 6 shoes / sandals / shoes (please no shoes). She's definitely a girly girl, loves her clothes. She doesn't like pink especially, but she likes her purple, yellow and green. She's also slim and tall. Certainly we accept second hand dresses well.\ n\ nWe're a little bit in financial distress and can't really afford a lot. Hopefully, things will be sorted up soon. I'm probably going to send out an offer in a few weeks, Aria's clothing 18 -"
"I feel like a little kid on Christmas Eve, knowing nothing about my gifts until another 24 hours passes lmao. \n\nShe was super cool about waiting until the appointment ended and it started weighing on her, too. \n\nAnyone else holding back on gender news?",1,False,False,False,False,False,False,False,False,False,False,False,False,False,False,False,True,False,False,False,False,False,False,False,False,False,False,False,False,False,False,I feel like a little kid on Christmas Eve and I cannot remember any presents until another 24 hours pass.\ n\ nShe waited super cool until the appointment was over and it started to strain her also.\ n\ nWho else is holding back with sex messages?
"Im 7 months pregnant and cant seem to find very much literature about exclusive pumping. I have decided to pump only because I have very sensitive nipples and they hurt just from being touched. Most women have not been shy about telling me how selfish and terrible I am for this decision. I want my child to be breastfed but I cant handle the pain. I was told that if i do not nurse immediately after the baby is born, my breasts will stop producing. If that is the case, should I pump as soon as I give birth to stimulate my breast? I am completely clueless and in desperate need of advice. ",1,False,False,False,False,False,False,False,False,False,False,False,False,False,False,False,False,False,False,False,False,False,True,False,False,False,False,False,False,False,False,"I choose to breastfeed because I have very sensitive nipples and hurt them, just because they are touched. I have found most women do not shrink from saying how selfish and awful I am for this decision. I want my baby to be breastfed, but I can not handle the pain. I have been told that if I do not breast-feed right after the baby is born, my breasts will stop producing. If that is the case, should I pump to stimulate my breast at the moment of delivery? I am completely unsure and absolutely need advice."
So me and my SO have been TTC for about six months now. I'm under 35 and he's over 35. I know they say you may be having fertility problems after one year of trying if you're under 35 or 6 months of trying when you're over 35. Is it time to schedule a fertility Dr. Appointment or wait another 6 months?,1,False,False,False,False,False,False,False,False,False,False,False,False,False,False,False,True,False,False,False,False,False,False,False,False,False,False,False,False,False,False,"I am under 35 and he is over 35. I know they say that you might have fertility problems after a year, if you are under 35, or have stretched for 6 months, if you are older than 35. Is it time to schedule an appointment for a fertility treatment by Dr. or wait another 6 months?"
"I'm using a throwaway, so I apologize in advance. I have been exclusively pumping for 8 months now, and I do supplement with formula. I take Domperidone to help with my supply issues. However, the past month I have had an issue with my right breast. This breast is the one who produces much less milk. It started off as just a cracking/bleeding issue, which I though lanolin was helping, but as time has progressed, I now have a large circle around my nipple that is completely pink, along with little red spots on the outside. The cracking/bleeding still happens every few days, and I've tried adjusting the suction on my pump to help, but I can't get it to fully heal. I don't breastfeed my baby at all, so it doesn't seem like the normal thrush/yeast issue. Any suggestions are appreciated! I bought some Vitamin E oil at the store yesterday per my doctor's suggestion.",1,False,False,False,False,False,False,False,False,False,False,False,False,False,False,False,False,False,False,False,False,False,True,False,False,False,False,False,False,False,False,"I make disposable products, so I apologize in advance. I've been pumping exclusively and adding formula for eight months now. I take domperidone to help with my supply problems, but last month I had a problem with my right breast. It's this breast that's producing significantly less milk. It started off just as a crack / bleeding problem, which I helped with nationally, but over time I have now a large circle around my nipple that's completely pink, along with small red stains on the outside. Cracking / bleeding problems still occur every few days, and I've tried to adjust the suction pressure of my pump to help, but I can't make the baby to the full heal. I don't breastfeed it at all, so it doesn't look like the normal throttling / yeast problem. All"
I live in Phoenix where our summers get into the 120's. So far I have had very little luck finding a system that isn't black or dark heat attracting colors. I don't want to put my baby in a something that will possibly hurt her or make very uncomfortable. Any suggestions out there for a desperate mommy?,1,False,False,False,False,False,False,False,True,False,False,False,False,False,False,False,False,False,False,False,False,False,False,False,False,False,False,False,False,False,False,I live in Phoenix where our summers stretch into the early morning hours of the 20th century. So far I have had very little luck finding a system that is neither black nor dark and beckons colors. I don't want to put my baby in something that might hurt or make him very uncomfortable.
We finally got a gate on our patio (second story). It is a pretty big space. I need to get some toys for my little guy to play with. He is 11mo but walking very well and is very active. Any suggestions?,1,False,False,False,False,False,False,False,True,False,False,False,False,False,False,False,False,False,False,False,False,False,False,False,False,False,False,False,False,False,False,"We're finally getting a gate on our terrace (on the second floor). It's quite a large space. I'll have to get toys so my little boy can play with them. He's 11 years old, but very well on foot, and he's very active."
"Anyone have any tips on how to change a childs poop schedule?\n\nMy 2 1/2 year old son is about 95% pee potty trained. He wakes up dry from his naps about 98% of the time and has woken up in the morning a couple of times completely dry.\n\nBUT... he poops in the middle of the night. He's not holding it in, because he gives a solid effort before he goes to bed actually trying to poop on the potty, but just nothing happens.\n\nI have tried waking him up and taking him to the potty before I go to bed (around 11pm) and he has not pooped yet and does not poop on the potty. I have tried waking him up early (which sucks cause most days he's awake at like 6am) and he has already pooped.\n\nAny advice on how to curb this problem would be greatly appreciated.",1,True,False,False,False,False,False,False,False,False,False,False,False,False,False,False,False,False,False,False,False,False,False,False,False,False,False,False,False,False,False,"Everyone has tips on how to change his children's peeing schedule?\ n\ nMy 2 1 / 2-year-old son is taught 95% peeing, he wakes up 98% dry from his nap and has woken completely dry a few times in the morning.\ n\ nBUT... he washes up in the middle of the night and he doesn't get up. Actually, he puts on his clothes properly before bedtime, he tries to pee at the potty, but nothing happens.\ n\ nI tried to wake him up and bring him into the potty before bedtime (about 11 p.m.), and he hasn't fallen asleep yet and won't poop the potty. I tried to wake him early (which sucks because he's up at 6 in the morning most days), and he was poin poop."
"We are just starting his journey. My daughter (6) knows her alphabet and can read a little. My son (4) couldn't care less about any of it, and we're okay with that for the time being.\n\nMy wife is overwhelmed to the point of tears and paralysis with actually getting started. Something of a perfectionist, she wants to be fully competent with the curriculum we have before ""officially"" starting down the homeschooling road.\n\nWe are using the ""Spell To Write and Read"" curriculum and we're wondering if there was any online community support/experience out there that we could tap into...?\n\nAll thoughts appreciated!",1,False,False,False,False,False,False,True,False,False,False,False,False,False,False,False,False,False,False,False,False,False,False,False,False,False,False,False,False,False,False,"They decide how much to give to the people, and how much to spend on it. My daughter (6) knows the alphabet and can read a little. My son (4) can't worry about anything else, and we are happy with it for now.\ n\ nMy wife is so overwhelmed with tears and paralysis that she has to get started. She wants to be a perfectionist, so to speak, and is fully familiar with the curriculum that we have before ""official"" enrollment.\ n\ nWe use the ""Reading and Writing"" curriculum, and we wonder, if there is an online community we could access....\ n\ nAll thoughts are welcome!"
"For those of you who take your babies to the store, what do you do when they start crying in the middle of your shopping?\nMy baby refuses his bottle so he is now EBF. When he\u2019s screaming my breasts are the only thing that will calm him down as he doesn\u2019t take a pacifier either. I left the groceries inside and now I\u2019m in the car soothing him waiting for him to fall asleep so I can go back in. He used to be so good in the car seat/stroller and now he\u2019s not having any of it. \nIs there an easier way? Or is this my life now? \U0001f602\n",1,False,False,False,False,False,False,False,False,False,False,False,True,False,False,False,False,False,False,False,False,False,False,False,False,False,False,False,False,False,False,"For those of you who bring your babies to the shop, what do you do when they cry in the middle of shopping?\ nMy baby refuses his bottle and is now EBF. My breasts are the only thing that will calm him when he cries and he does not take a pacifier. I left the groceries in and now I am in the car calling him to get him to sleep, so that I can go back inside. He was so good in a car seat / buggy and he is having none of it.\ nIs there an easier way? Or is this my life now?\ U0001f602\ n"
"My son is about 3 weeks old and less than a week ago he's started to groan a lot when we put him in his bassinet to sleep. It isn't really a pained sound, imagine the sound you make when you stretch your arms and legs first thing in the morning - which he's doing too. He seems to be constantly stretching his arms and legs. Is it possible he's getting muscle cramps?",1,False,False,False,False,False,False,False,False,False,False,False,False,False,True,True,False,False,False,False,False,False,False,False,False,False,False,False,False,False,False,"My son is about 3 weeks old and less than a week ago he started to moan a lot when we squeezed him into his basin. It's not a really painful sound, imagine how you first stretching out your arms and legs in the morning - which he does. He seems to keep stretching his arms and legs. Is it possible that he is getting muscle spasms?"
"Does anyone here practice attachment parenting with their multiples? It seems like all my friends use this parenting style, and I feel like it\u2019s pretty much impossible to implement with multiples, given that we do a lot of things to save our sanity, like putting the babies on a schedule. I feel like I might have tried out attachment parenting if I had a singleton, but with twins I\u2019m just doing whatever I can to survive. Just curious what everyone\u2019s experience has been.",1,False,False,False,False,False,False,False,False,False,False,False,False,False,False,False,False,True,False,False,False,False,False,False,False,False,False,True,False,False,False,"I have the feeling it is nearly impossible to do multiples considering that we do a lot of things to save our sanity, like putting babies on a full plan. I feel like I would have tried bonding motherhood if I had a singleton, but with twins I'm only doing what I can to survive. It's just curious what everybody's been through."
"I don't plan to breastfeed and was wondering what bottles you all have had the most luck with, especially if you formula fed from the very beginning. Thank you!!",1,False,False,False,False,False,False,False,True,False,False,False,False,False,False,False,False,False,False,False,False,False,True,False,False,False,False,False,False,False,False,"I didn't plan to breastfeed, I wondered which bottles you all had the most luck, especially if you have used formula from the very beginning. Thanks!!"
"Hey! My wife and I have talked about adoption for several years, and it just dawned on me that there would be a sub for it. \n\nHere\u2019s my question, and I mean no offense, just being candid with my fear:\n\n*How can you love an adopted child as much as your flesh and blood?*\n\nIn principle, I believe that I can, just based on the experience of friends who have adopted or who were adopted. But in practice, I have never, ever experienced anything like the love I have for my 2 year old daughter. I miss her while I\u2019m at work, I have to resist showing everyone pictures of her... and she looks like me, except the times she looks like my wife. She melts my heart. \n\nI love the idea of adoption, but I hate the idea of having a favorite child. Honestly, I don\u2019t think it would be an issue, but the fear is enough to make me Think twice about adopting. I would love to hear thoughts from others who have adopted after having a biological child or children, or who have been adopted into that situation.",1,False,False,False,False,False,False,False,False,False,False,False,False,False,False,False,False,False,False,False,False,False,False,False,False,False,True,False,False,False,False,"I mean, this is not an insult at all, just frankly handling my fear: ""How to love an adopted child, how much flesh and blood?"" I think I can, simply based on the experience of my friends who've adopted or were adopted. However, in practice, I've never experienced anything like the love I have for my 2-year-old daughter. I miss her while I'm at work, I have to refuse to show any images of her... and she looks like me, except for the times when she looks like my wife."
"I registered for a marathon next June about a week before finding out my wife and I were pregnant.  Obviously being with our baby comes before my training but does anyone have any advice/tips on how to stay reasonably on track with training/fighting ""dad bod"" once our little one comes in January?",1,False,False,False,False,False,False,False,False,False,False,False,False,False,False,False,False,False,False,False,False,True,False,False,False,False,False,False,False,False,False,"I tried to register for a marathon next June, about a week before I learned that my wife and I were pregnant. cope, of course, with our baby coming before my workouts, but does anyone have any advice / advice on how to stay on track through training / fight with ""dad bod"" when our offspring arrive in January?"
How much is too much? When do you start weening (that's Queens English for starting solids)? What the hell are all these different kinds of formula? What kinds of bottles do you use? Did anyone else make their kid an awesome dinner and they threw it on the floor and then cried for bottle? Let's talk about feeding these glorious little people! \n,1,False,False,False,False,False,False,False,False,False,False,True,False,False,False,False,False,False,False,False,False,False,False,False,False,False,False,False,False,False,False,"How much is too much? When do you start weekending (that's the English for solid start)? What the hell are all these different remedies? What bottles do you use? Did someone else prepare a great dinner for your child, and throw him on the floor, and then cry after the bottle? Let's talk about feeding these glorious little people!\ n"
"I put on Rugrats for my 3 (almost 4) year old yesterday.  During the second episode, he wandered off to play with a box.  After 10 minutes of him not watching I told him I was going to change it if he wasn't going to watch.  He didn't say anything.  I switch it back to The Simpsons marathon.  He comes running up to me with a really mean face, looks at me and says ""Put Rugrats back on"".  I told him no (he knows not to ask with that tone).  Then he looks at me with his puppy dog eyes and says ""Dada, don't say no, say yes.""",1,False,False,False,False,False,False,False,False,False,True,False,False,False,False,False,False,True,False,False,False,False,False,False,False,False,False,False,False,False,False,"I dressed my 3 (nearly 4) year old Rugrats friend yesterday. In episode 2, he turned into a box of toys. After not watching for 10 minutes, I told him that if he didn't watch, I would change him. He didn't say anything. I switched back to The Simpsons Marathon. He came up to me with a very naughty face, looked at me and said: ""Putting Rugrats back on."" I said no (he doesn't know how to ask in this tone) and then he looked at me with his puppy eyes and said: ""Dada, don't say no, say yes."""
"I know I\u2019m not the only one in this boat and could really use some encouragement.  \n\nI go back to work in a week and a half.  I\u2019ve been inconsistent about getting my baby on a bottle because I\u2019ve loved breastfeeding so much (way more than I thought I would). It was our special time together.  \n\nHe hasn\u2019t taken to the bottle so easily and now because I\u2019m sad about leaving him to go back to work, I\u2019m extra sad I can\u2019t just nurse him these last few days.  \n\nI knew going back to work would be hard, but man this sucks.  I even like my job, but I can\u2019t imagine being away from my baby.  He knows who I am and she smiles and laughs with me.  I\u2019m so sad to take that connection way from him. \n\nWhy does being a mom have to be so hard? It\u2019s so amazing but so fucking tough.  ",1,False,False,False,False,False,False,False,False,False,False,False,False,False,False,False,False,False,False,False,False,False,True,False,False,False,False,False,False,True,False,"I know I'm not the only one in that boat and feel I have to take a little encouragement from him.\ n\ nI'd go back to work a week and a half from now.\ nHe's not picked up a bottle and now that I am sad that I'm letting him go back to work, I'm even more sad that I've been able to breastfeed him for the last few days.\ n\ nI knew it'd be difficult to work again but people suck me. I even like my job but I can't imagine being away from my baby. He knows who I am.\ n\ nShe smiles and laughs with me.\ u2019m is so sad to have to be having to take that path, ""he said.\ n\ nWhy must it be so hard to be that hard?"
"Yeah, so we all know cradle hold. \nAnd then things got fancy with football holds and laid back nursing and reverse cradle... \n\nBut my 10m old has a new favorite position, which involves my lying down flat on the floor while she leans across my body while aggressively planking. (Downward dog! Plank! Downward dog!) Her tush usually ends up on my face and somehow she always seems to be trying to stick a foot in my mouth. Through this she absently scratches me with her razor talons (I can't cut them fast enough. They grow overnight!) and mumbling things with a boob in her mouth. \n\nI call it ""zombie feeding on prey"" position. \n\n\U0001f923\U0001f923\n\nHow bout you? Lo got any 'unique' preferences? \n",1,False,False,False,False,False,False,False,False,False,False,False,False,False,False,False,False,False,False,False,False,False,True,False,False,False,False,False,False,False,False,"Yes, that's why we ޫ all know Cradle Hold.\ nAnd then it came with football handles and a relaxing nursing and retreat bed pretty thick...\ n\ nBut my 10m-old has a new favourite position, where she lies flat on the floor and bends aggressively over my body on it. (Razor! boards! razor blades!) Her brush usually lands on my face, and somehow she always seems to be trying to put a foot into my mouth, which makes her scatter me with her razor clips (I can't slice them fast enough, they grow overnight!) and murmur some thing with a breast in my mouth.\ n\ nI call it ""zombie food on booty"" position. * n\ n\ U0001f923\ U0001f"
"I've been out of cloth diapering for a couple of years now, but expecting a new babe in April. We used prefolds and covers in the early days with my oldest and intend to do so again. \n\nI gave away my newborn cover stash, which was mostly Assunta. I now understand they no longer sell covers :( it's really too bad because they were great quality for the price!\n\nAny recommendations on cheaper covers for newborns? I'm not really willing to pay more than about $12-$15 per cover and I'm in Canada (will buy from anywhere though)",1,False,False,False,False,False,False,False,True,False,False,False,False,False,False,False,False,False,False,False,False,False,False,False,False,False,False,False,False,False,False,"We used prefolds and covers with my elders in the early days and want to do it again.\ n\ nI handed over my newborn lid stash, the majority of which was Assunta. I understand now that they are no longer selling covers. (That's a real shame because they had great quality at their prices!\ n\ nNo recommendation for cheaper neonates covers? I am not really willing to pay more than about 12-15 $per cover and I am in Canada (but I'll buy them from anywhere)."
