text,label,potty training,other,walk training,economy,child milestones,childcare,school,child product,mom health,discipline,baby food,child behavior problem,sinle parents,child health,sleeping,pregnancy,parent-child interaction,language training,parent education,emotion coaching,dad parenting,breastfeeding,play,sell exchange,parent support,non-biological parents,multiple children,child appearances,working parents,birth,aug
"I'm a stay at home mom to a 9 month old. I have to interact with her literally nonstop or she yells, squawks, and cries. I don't have time to do anything. There's no such thing as just putting her down on the floor and having her entertain herself for even 15 minutes. It would be nice to make myself something to eat without her hanging on my pant leg screaming. \n\nIs this normal? Am I spoiling her? Is she needy? WHAT DO I DO? \n\nI read about other parents who sit their kid (around the same age) down in front of a TV for hours at a time while they browse the internet. Meanwhile I feel like a shitty mom at the end of the day because we played with different toys in every room of our apartment, went for a walk, swung on the swing at the park, played in the leaves, and had snack times with new foods AND I STILL FEEL LIKE I'M NOT DOING ENOUGH. \n\nIs this just how life is with an almost toddler or do I need to do something different?",1,False,False,False,False,False,False,False,False,False,False,False,True,False,False,False,False,True,False,False,False,False,False,False,False,False,False,False,False,False,False,"I am a mother to a nine month old child at home. I have to interact with her constantly or she will screech, screech and cry. I feel really uncomfortable doing anything, there is no reason to just lay her on the ground or let her talk for 15 minutes. It would be nice for me to get something to eat without her screaming at my trouser leg.\ n normal life? Do I spoil her? is she needy? WHAT DID I DO?\ n I socialize with other parents who sit at their child's (about the same age) TV for hours while they browse the internet. Meanwhile, I feel like a shitty mother at the end of the day because we played with different toys in every room of our apartment, went on a walk, swung in the park, played in the leaves and ate snacks"
"Looking for a little help here. I accidentally left a wet all in one cloth diaper sitting out for about 3 days. It smelled like it had gone ""stale"" when I threw it in the wash and still smells bad after being washed 3 times. What do I do to get it smelling nice again? I can't strip it with bleach and I'm worried about soaking it because I don't want to damage the PUL fabric outer layer.",1,False,False,False,False,False,False,False,True,False,False,False,False,False,False,False,False,False,False,False,False,False,False,False,False,False,False,False,False,False,False,"By chance I left a wet cloth diaper that I had been painting for three days. It smelled like it had ""stalled"" when I put it in the wash and still smell bad today after washing it three times. What can I do to make it smell good again? I can't continue to wipe it with bleach and I worry about soaking it, because I don't want to damage the surface of the PUL fabric."
Hi Ladies \nI have a $5 Similac coupon it expires the end of this month my LO uses Enfamil so I have no use for it PM I can send out today,1,False,False,False,False,False,False,False,False,False,False,False,False,False,False,False,False,False,False,False,False,False,False,False,True,False,False,False,False,False,False,"Hi ladies. I have a coupon worth $5 Similac that expires at the end of this month, my LO uses Enfamil so I have no use for it."
"Hey everyone, I'm just coming off a month of leave and have a 1 month old at home. My wife and I are really worried about the flu.\n\nI know a few co-workers have been out with it already. I wiped down all my equipment, am washing/santizing my hands frequently, and staying away from common areas.\n\nYou all have any additonal tips that have worked for you on keeping free from illness at the workplace.\n\nThanks in advance!",1,False,False,False,False,False,False,False,False,False,False,False,False,False,True,False,False,False,False,False,False,False,False,False,False,False,False,False,False,True,False,"Hi everyone, I just returned from one month holiday and have a month's holiday at home. My wife and I are really worried about the flu. / n\ nI know that embassy staff have been with her. I've rubbed off all my clothes, wash / throw my hands frequently and stay away from public areas. / n\ nYou all have several tips on how to apply them to keep you accident-free at work. / n\ nThank you in advance!"
"I often ask my daughter if she's ""running out of steam"" when she seems tired. So when I picked her up at day care the other day, she announced that her ""steam"" was ""all gone."" I couldn't resist asking her where it went. She pointed up at the ceiling. ""It's all up there."" \n\nOf course it is. ",1,False,False,False,False,False,False,False,False,False,False,False,False,False,False,False,False,True,False,False,False,False,False,False,False,False,False,False,False,False,False,"I often ask my daughter, given her appearance of tiredness, if she is ""running out of breath."" When I picked her up the other day at the day care service, she said that her ""steam"" was gone. I couldn't resist asking her where it is going. She pointed upwards to the ceiling. ""Up there is everything."""
"I think I feel safe to say our baby girl is sleeping through the night! At least it has been more often than not the past couple of weeks, and some good consecutive 4-day stretches! She is turning 9 months old on Saturday, so new parents out there -- hold on! That day will come!!",1,False,False,False,False,False,False,False,False,False,False,False,False,False,False,True,False,False,False,False,False,False,False,False,False,False,False,False,False,False,False,"In my opinion, I'm sure our baby is sleeping all night! At least it's been the case several times in the last couple of weeks, and some good consecutive 4-day stretches! On Saturday she'll be 9 months old, so new parents on the way -- wait a minute! That day is coming!!"
I Have the Ergo360 and I love to use it with my now 1 year old. I dont know how long she would want to be on a carrier as she gets older. The ergo only goes to i think 28 lbs? so I was thinking of getting another one with a heavier weight limit. But I am not sure until when my daughter would want to be on a carrier.,1,False,False,False,False,False,False,False,True,False,False,False,False,False,False,False,False,False,False,False,False,False,False,False,False,False,False,False,False,False,False,"I have the Ergo360, and I love using it with my one-year-old. I don't know how long she would like to be on a rack as she gets older. Ergo is only estimated at 28 kilograms, so I've thought about getting another rack with a larger weight restriction, but until I know when my daughter wants to ride on a rack I don't know."
"I am going to take my 4.5 yr old daughter skiing for the first time in a week or 2. I haven't been in years, but my FIL is big into it.\n\nWe're going to enroll her in ski school. They have a few different options, (90 minutes, 2.5 hours, etc).  I'm not sure what would be best, as well as what people who have done this have walked away with. I don't expect her to be a slalom racer, but will she at least be able to stop?\n\nMy FIL bought the kid harness and plans to use it after the school to do a bit of teaching and reinforcing.\n\nI'll be nearby, not skiing this time around.\n\nSo, other dads... any experiences, guidance, or feedback?\n\nOh, if it matters, this mountain is about 2.5 hours from us, so we'll be leaving at the ass crack of dawn, which isn't a bit stretch from our normal week day.",1,False,False,False,False,False,False,False,False,False,False,False,False,False,False,False,False,False,False,False,False,False,False,True,False,False,False,False,False,False,False,"t been there that long, but my FIL is very big. I expect to take her on the ski course, and also have some other options (90 minutes, 2.5 hours, etc.). I am not sure what is the best thing and how the people who did that did not do it for her. I don't expect that she will become a slalom contestant, but at least she will be able to stop.\ n\ nMy FIL has bought the harness and plans to use it for a little bit of training and support after school.\ n\ nI wouldn't be standing on skis this time, but I will be close.\ n\ nSo, other ideas... any experiences, guidances or feedback?\ n\ nOh, if it is important, this mountain will be 2.5 hours away from us."
"Currently my wife and I have one beautiful daughter of 8 months. I want more but she doesn\u2019t. If you ask people with only one child, they say one child is better. What are the benefits on having two kids? \n\nEdit: I want another one. Not immediately, but soon. We are almost 40 years old and time is running short. I don\u2019t feel we have the luxury of waiting too long. Sorry, I should have explained this earlier. ",1,False,False,False,False,False,False,False,False,False,False,False,False,False,False,False,False,False,False,False,False,False,False,False,False,False,False,True,False,False,False,"She said: 'My wife and I have a beautiful daughter of 8 months. I want more, but she doesn't need it. If you ask people with only one child, they say that a child would be better. What would be the benefit of having two children?\ n\ nEdit: I would like one more. Not immediately, but soon. We're in our 40s and time is running out. I don't think we'll have the luxury to wait too long. Sorry, I should have told you earlier."
"What breaks our hearts the most is our five year old son who had already become attached to his baby brother.\n\nEdit: I cannot believe how many people here seem anti-adoption. I was looking for advice during a difficult time. Some of you people are just hateful. A public forum, yes, but asking \u201cany advice how to cope\u201d should not elicit comments about the birth mother. I said she changed her mind. I did not judge her. We are hurting, and I thought that r/adoption might be the place for advice. \n\nFor those of you who had a poor experience with adoption, I\u2019m sorry for you. We are getting counseling. Maybe some of you should, too. ",1,False,False,False,False,False,False,False,False,False,False,False,False,False,False,False,False,False,False,False,False,False,False,False,False,False,True,False,False,False,False,"t believe how many people here apparently are lookalike adopters, I was looking for advice in a difficult time and some of you are just hated, a public forum yes, but asking advice on how to handle it should not prompt comments on the biological mother. I said that she had changed her mind, I did not judge her. We hurt her or I thought that R / adoption might be the place for advice.\ n\ nFor those of you who have had a bad experience with adoption, I am sorry for you. We're taking advice, maybe some of you, too."
"My wife and i have a 5 month old now, and while she is the best, she gets loud sometimes, especially at 4 or 5 am. We share a wall with our neighbor, and although we try and keep her out of that room, sometimes we need to bring her into there.\n\nI had read somewhere about sending over a little gift to your neighbors, especially if you aren't already friendly with them. We got our neighbor a bottle of wine and wrote a card apologizing for any noise, and got a nice card back the next day. The next time we saw each other in the hallway, we had a friendlier conversation than we've ever had before. It's a simple little gesture that was very appreciated, and even got me brownie points with the wife for thinking of it. And it turns out she never hears our daughter anyway, which is great to know and lowers our stress level.\n\nBest to all you future dads, it's truly the best!",1,False,False,False,False,False,False,False,False,False,False,False,False,False,False,True,False,False,False,False,False,False,False,False,False,False,False,False,False,False,False,"My wife and I have a five-month-old son now, and while she does best she sometimes gets noisy, especially at 4 or 5 in the morning. We share a wall with our neighbor, and we try to keep her out of the room, sometimes we have to bring her there.\ n\ nI had read somewhere about you sending a little gift to your neighbors, especially if you're not with them already iP.We got a bottle of wine from our neighbor and we wrote an apology for her noise, and got her back the next day. Next time we saw each other in the hallway Portland, we had a friendlier conversation than ever. It's a simple small gesture that was much appreciated, even earning me Brownie points with his wife. And it turns out she never hears our daughter anyway, which is great to know and lower our stress levels.\ n\ nGreat thing for everyone to hear.\ n"
I have 4 or 5 $5 Similac checks... looking to trade for Enfamil checks because we're no longer using Similac. Thanks!,1,False,False,False,False,False,False,False,False,False,False,False,False,False,False,False,False,False,False,False,False,False,False,False,True,False,False,False,False,False,False,I have 4 or 5 $5 Similac checks... looking for enfamil checks to trade because we are no longer using Similac. Thanks!
"I lost my job a few weeks ago. We now have help for food, bills, and healthcare. We will not lose our home as we rent from family. Waiting on a decision on whether or not I get unemployment benefits. But what about Christmas? My daughter is 4 and deserves to get presents from Santa. \n\nI'm looking into donating plasma just to get some cash. I'm doing mechanical turk and beer money stuff, using cash back apps and all that. And I'm looking into who to contact to receive toys from Toys For Tots donations or a similar program.\n\nShe's only 4. She knows mama doesn't have a job anymore and that we don't have money, but she doesn't understand what it means. Her dad is in another state and is worse off than me, so he's no help in this situation. My goal is to get $75 for toys and craft/art supplies.\n\nAny suggestions or ideas on how to get money to buy gifts would be much appreciated. I'm in Portland, OR if that helps.",1,False,False,False,True,False,False,False,False,False,False,False,False,False,False,False,False,False,False,False,False,False,False,False,False,False,False,False,False,False,False,"I lost my job a few weeks ago, now we have food assistance, bills and health care, we are not going to lose our home by renting to our families, waiting to decide whether or not I will receive unemployment benefits, but what about Christmas? My daughter is 4 and earns presents from Santa.\ n\ nI'm looking for donations just to get some money. I do mechanical turk and beer money stuff, pay cashback apps and all that. And I'm looking for whoever I can turn to for toys from Toys For Tots donations or similar programs. Puppy's only 4. DJs are aware that Mom has no more jobs and we don't have any money, but she doesn't understand what this means. Her father is worse off in a different state than me, so he's not having any help in this situation."
"So here I am, breastfeeding and also pumping (about to head back to work)  I'm using this fancy Medela 'pump in styleee advance'  It's petty decent.  I pump into a bottle, then transfer bottle into bag, then when it's time to feed, heat the bag and transfer BACK to the bottle. This seems redundantly redundant if you ask me.  \n\nI've briefly poked around on The Google and seen nothing, but wondering if any of you experienced ladies have run across something like one of those 'drop in' bottle liners that you can pump directly into and also use as a storage bag?  Some sort of fancy combo dealy-ma-bobber?  Seems like if it did exist it would be super fantastic.\n\nTLDR:  Is there such a thing as a combo milk storage bag you can pump directly in to, that is also a 'drop in' bottle liner?\n\nEDIT:  Dur..  I feel like tard.  Here it is:  \n\nhttp://www.drugstore.com/products/prod.asp?pid=347172&amp;catid=182624&amp;aid=338666&amp;aparam=goobase_filler&amp;device=c&amp;network=g&amp;matchtype=\n",1,False,False,False,False,False,False,False,True,False,False,False,False,False,False,False,False,False,False,False,False,False,True,False,False,False,False,False,False,False,False,"And here's why, on breastfeeding and also during pumping (just before I go back to work), I'm coming up with this fantastic Medela 'pump in style forward'. I pump up into a bottle, then pump bottle into bag, then when it's time to feed, I warm the bag and slide backwards onto the bottle. That just seems redundant, if you ask me.\ n\ nI've briefly booted through Google and seen nothing, but I'm wondering if one of your experienced ladies came across something like a 'drop-in' bottle bag that you can push directly in and use as storage bag? Something like a fancy combo deal ma bobber?"
I have been with this company for almost 4 years and a great promotion was offered to me but it includes traveling. Maybe once every 2 months for a week.. I would be traveling within the U.S. \n\nI have a 5yo (M) and I am a single mom.. I am fortunate to have my parents and my brother that are able to help me with my son. His father is also in the picture and sees him every other weekend. \n\nI can really use the money and the experience in this field but at the same time I would feel so guilty taking this knowing I have a son. I can barely handle him being with his dad on weekends.. and being away for a week will be hard on him and on myself. \n\nI traveled to California for work a couple months back and my sons father made a comment about how I shouldn't be traveling because I am a mom.. \n\nI would like some feedback from all traveling parents..\nIs this something that I should not take on? Will it affect my son?\n\n,1,False,False,False,False,False,False,False,False,False,False,False,False,False,False,False,False,False,False,False,False,False,False,False,False,False,False,False,False,True,False,"People often include me. It has been me for almost 4 years and I have received a great promotion, but also travelling. Maybe once every 2 months for a week.. I would travel within the USA.\ n\ nI have a 5 year-old patient and I'm a single mother. I'm lucky to have my parents and my brother to help me with my son. His father is also in the picture and sees him every other weekend.\ n\ nI can really use the money and experience in this area, but at the same time I would feel so guilty about bearing it because I have a son. I can't bear him being with his father every weekend.\ n\ nIs this something I can't take over?"
I personally EP'd for 5 months and then my son finally got the hang of BFing. \nNow how about you ladies?,1,False,False,False,False,False,False,False,False,False,False,False,False,False,False,False,False,False,False,False,False,False,True,False,False,False,False,False,False,False,False,I personally would play EP for 5 months and then my son finally got the hang of it.
"He's been drooling like crazy for about a month. Now I can feel bumps in his gums and I'm sure it's unpleasant. He gets fussy off and on. I didn't expect him to start this young so I have no idea how to help him. He can't really hold things in his mouth by himself for very long. He'll chew on my hand or his own fingers. I'm not sure I can give him pain relief yet. He doesn't cry out like he's in pain, just fussy. \n\nAnyone else have an early teether? Any advice to help the little guy? ",1,False,False,False,False,False,False,False,False,False,False,False,False,False,True,False,False,False,False,False,False,False,False,False,False,False,False,False,False,False,False,"He's been drooling for about a month, but I've noticed bumps on his gums now and I'm sure that's unpleasant. He's getting a bit fussy. I didn't expect him to start so young, so I don't know how to help him. He can't hold things in his mouth for really long, he'll chew on my hand or his own fingers. I'm not sure I can give him pain relief. He's not shouting as if he is in pain, he's just so tight."
"My daughter is 5 months old and will not be able to receive the flu vaccine for another month. I am going back and forth on taking her to receive her Ashes on Wednesday. \n\nWe have been staying home the entire flu season, only going to the doctor. Are there any parents bringing their little babies to church? What are your experiences?\n\n(Our church itself is extremely family friendly and has a ton of children of all ages.)",1,False,False,False,False,False,False,False,False,False,False,False,False,False,True,False,False,False,False,False,False,False,False,False,False,False,False,False,False,False,False,My daughter is five months old and will not be able to get her flu shot for another month. I will go back and forth with her for her ashes on Wednesday.\ n\ nWe will stay home all the time and only go to the doctor. Are there parents bringing their babies to the church?\ n\ n (Our church itself is extremely family friendly and has lots of children of all ages.)
"Hey guys! I'm new to this subreddit, my first (daughter) just turned 1, so I'm moving from the baby subs to start learning about the wonderful/awful phase that is toddlerdom. \n\nMy daughter is pretty independent, can play on her own in the playpen for an hour without incident. But every now and then, she gets sooooo whiney! How do you guys handle that?\n\nExample: she's playing with the mega blocks table, wants to remove one of the pieces and can't right away, so she whines. Or she's pulling on the belt loop on my dress right now, and it isn't coming off (fancy that), so she whines. How do you guys manage that? I've tried saying ""no whining"" when she does it, but how do I get her to understand what I'm saying?\n\nI'm so worried I'm going to raise a needy brat. She listens to my husband but not me. And I think it's because I don't have as stern a voice as him (I have a pretty high pitched voice). Halp plz!",1,False,False,False,False,False,False,False,False,False,False,False,True,False,False,False,False,False,False,False,False,False,False,False,False,False,False,False,False,False,False,"That would make it very hard for me as I am a completely new partner. Hey guys! I'm new to this part-time shop, my first (daughter) has just turned 1, so I'm moving off from the baby subway to get to know the wonderful / horrible period of being a toddler.\ n\ nMy daughter is pretty independent and can play alone in the playpen for an hour, without incidents. But every now and again she gets sooooo muddy! How do you guys deal with that?\ n\ nExample: she plays with the mega-block table, wants to remove one of the parts from the playpen and can't do it straight away, she wails. Or she pulls the belt loop on the dress now and there's no way away (great stuff), which makes her whine."
"I have a daughter who's 3 and extremely hyperactive. I've been thinking that her energy level is just normal for a young child for a while, but it's gotten to the point she drives me up the wall and damages things. She will tear paint off the wall, bang against her bedroom door, remove her clothes, throw toys at others, and rarely ever listens or participates in activities due to her short attention span and inability to sit still. Whenever I try to reprimand her or give her and instruction, she completely ignores it. We're in the process of moving, I will make her an appointment with the doctor soon, but I'm really not sure what to say to her doctor to test her. Do I just go in and say ""hey, I think my daughter has ADHD?"" This might sound like a ridiculous question, but I just want to be taken seriously by her doctor. How do they diagnose it? Will she need to see a child psychiatrist?",1,False,False,False,False,False,False,False,False,False,False,False,True,False,False,False,False,False,False,False,False,False,False,False,False,False,False,False,False,False,False,"I have a daughter who is three years old and extremely hyperactive. I've been thinking for a while that her energy levels are normal for a young child, but she pumps me against the wall and damages the things. She rips paint off the wall, bangs on her bedroom door, drums off her clothes, listens to other toys and seldom listens or participates in activities because of her short attention span and sedentary inability. Whenever I try to refer her or give her a warning or instruct her, she completely ignores them. We're about to move, I'll see her soon, but I'm really not sure what to tell her doctor for him to investigate her."
"Hi everyone, my friend Lauren and I have noticed a lack of internet space/support for mothers that are returning to work after maternity leave and are pumping.  Lauren has two kids and I have four and we've pumped at work and know how much of a drag it can be but we still think it's worth it...We are working on compiling information that we think would be helpful and would love input on what types of resources you think would be helpful that we could add.  Thanks in advance!",1,False,False,False,False,False,False,False,False,False,False,False,False,False,False,False,False,False,False,False,False,False,True,False,False,True,False,False,False,True,False,"Hi everyone, my friend Lauren and I have found that there is a lack of Internet / support for mothers who return to work and pump after maternity leave. Lauren has two children and I have four and we have pumped a lot at work and we know how much work it can do, but we still think this is worth it... We are working on gathering information that we think would be helpful and would be happy for input on what kinds of resources we think we can do better. Many thanks Schmitt in advance!"
