text,label,potty training,other,walk training,economy,child milestones,childcare,school,child product,mom health,discipline,baby food,child behavior problem,sinle parents,child health,sleeping,pregnancy,parent-child interaction,language training,parent education,emotion coaching,dad parenting,breastfeeding,play,sell exchange,parent support,non-biological parents,multiple children,child appearances,working parents,birth,aug
"My 4 year old son decided he wanted to make his room his and started sleeping in it and slept in it and loved it and did great, for about a month and then suddenly didn't like it anymore. Nothing happened that I can think of. Now he is saying he is not ready for his room. OMG that month was amazing for all of us. How can we get back there again? Have any of you gone through this? ",1,False,False,False,False,False,False,False,False,False,False,False,False,False,False,True,False,False,False,False,False,False,False,False,False,False,False,False,False,False,False,"My 4 year old son decided he wanted to make his room his own and began sleeping in it, and he was sleeping in it and loving it and doing it great, for about a month, and then suddenly it stopped, and nothing happened to me that I can imagine. He is now saying that he's not ready for his room. OMG this month has been great for all of us. How can we get back to there? Has any of you gone through this?"
You give me hope that a brighter day when will come for us one day. I left when my son was 3 months old and moved in with my parents. My son's alcoholic Dad has rarely asked about him. He was picked up for felony armed robbery December 6th. I just got a letter from him to my son from prison and it's too little too late. As of the writing of this letter is had been since August since he asked me anything about him. I lurk this sub to see dads stepping up and loving their babies. I envy your children and their mothers. Might I add that my son's birthday is in February and don't be fooled by this letter it is a crock of crap. Manipulation at its lowest.\n\n[The letter and a picture of my little dude](https://imgur.com/a/Cwn2S)\n\n**Edit: there is a bit of backstory in the comments and I didn't come here to bad-mouth him I came here to tell you I admire all of you awesome dads!**,1,False,False,False,False,False,False,False,False,False,False,False,False,False,False,False,False,False,False,False,False,True,False,False,False,False,False,False,False,False,False,He has now picked me up from jail and point out how my son gave birth to his son in February and hadn't asked me since August. Manipulation at the lowest level. I'm lurking on this website to see how fathers get up and love their babies. I envy you and your children. I may add that my son is in February and should not be cheated on by this letter.\ n\ n [The letter and a picture of my little guy] (http: steiner-kw.de / a / Cwn2S)\ n\ n\ * Edit: it is a bit of background story in the comments and I didn't come here to bad-talk him.
"Hi guys,\n\nIt looks like my wife has circumstances which make breastfeeding a struggle and now with our newborn I'm trying to wrap my head around all the rules for feeding her.\n\nWe got some liquid concentrate formula from similac, and I was wondering how exactly we prepare that stuff for feeding away from home.  Also what are the general rules before the formula is unusable? \n\nThanks guys!",1,False,False,False,False,False,False,False,False,False,False,False,False,False,False,False,False,False,False,False,False,False,True,False,False,False,False,False,False,False,False,"Hi folks.\ n\ nSeems like my wife is having to deal with circumstances making breastfeeding into a struggle, so now I have to try and read all the rules of her diet with our newborn.\ n\ nWe have Similac liquid concentrate formula and I wonder how we make that stuff for home-made feeds, also what are the general rules before the formula stops working?"
"When I pump, it takes only about 5 minutes on either side (if that) before my milk flow stops and I have to *really* squeeze my breast to get anything further out with my pump, I'm only getting 1 oz from each side every 3 hours too. At this stage I usually pump for another 2 minutes because I'm trying to build my supply.\n\nI was just wondering whether there was any chance if i kept pumping if I'd have another letdown? I hear about all of these Mums who pump for about 40 or so minutes, is that with a constant flow or does it start/stop? \n\nAs I'm using an Avent pump, I don't have a 'letdown' setting, nor can I change suction, so I was wondering if there is any best speed/pattern to use to achieve letdown? I usually pump quickly at first and once the milk starts flowing slow down. \n\nThanks in advance",1,False,False,False,False,False,False,False,False,False,False,False,False,False,False,False,False,False,False,False,False,False,True,False,False,False,False,False,False,False,False,"When I pump, it would take only about 5 minutes on both sides (and if you do) for my milk to stop flowing, and I * really * need to squeeze myself to move a little further out with the pump. At that point, I only get about 1 ounce of it every 3 hours. These days, I usually pump another 2 minutes, because I'm trying to build up my supply.\ n\ nI just wondered if there was any chance that I would keep pumping if I was disappointed a second time? I hear from all of the pumps for about 40 minutes, is that a consistent flow or is it going to start or stops?\ n\ nAs I use an Avent system, I don't have a ""Letdown"" setting, nor can I replace the suction, so I wondered if it was going to work?\ n\ nOnce I had the Avent system, I was trying to change the drainage setting."
"Leftie was always a bit larger, but since breastfeeding, both grew, but leftie grew more. It also produces more, when LO was tiny she always fussed more on rightie until I switched her over. I try these days to start her on rightie, but she only nurses mornings and evenings now.\n\nI pump once a day around 15:00 (I used to pump mornings too, but slowly stretched it out and stopped). I feel like the size difference has grown the past 2 months even more. Rightie barely gives me 20 ml, leftie gives me 60 (sometimes between 50-90).\n\nIf I start pumping only rightie in the mornings again, will their sizes even out?",1,False,False,False,False,False,False,False,False,False,False,False,False,False,False,False,False,False,False,False,False,False,True,False,False,False,False,False,False,False,False,"I try to pump on my right foot now, but I feel that they only breastfeed in the morning and in the evening.\ n\ nI pump once a day at 3pm (I also pump in the morning but pushed the button slowly and stopped). I feel that in the last two months the size difference has become even bigger - right-handers give me hardly 20 ml. and left-handers give me 60 ms. sometimes between 50 and 90.\ n\ nIf I pump only my right foot again in the morning, will they feel better?"
"I've been hand washing all the bottles and nipples and it takes forever. I could spend an hour over the sink everyday. We have a sterilizer which I use every other day or so, but we aso have a dishwasher basket. Yesterday I tried out the basket and all the bottles came out with hard water spots. Is this okay? Do I have to keep hand washing? Also, does everyone use normal dishwasher detergent or baby safe? They came out smelling like chlorine but it went away when I just rinsed them quickly in the sink. This is so much more annoying than breastfeeding!&gt;&lt;",1,False,True,False,False,False,False,False,False,False,False,False,False,False,False,False,False,False,False,False,False,False,False,False,False,False,False,False,False,False,False,"I am hand-washing all bottles and nipples and it takes me forever, can be above a sink for hours every day for an hour, with sterilizer which I use almost every other day and then perhaps also with the dishwasher basket. Yesterday I tried it and all the bottles came with plastic-hardened water stains. Is it alright? Do I have to wash my hands? Does anyone use regular dishwasher detergent or baby storage? It smells of chlorine - but that was gone when I just rinsed it quickly in the sink. That's so much more annoying than breastfeeding! & gt; & lt;"
"We've tried candy rewards and stickers. We made a big deal about giving her a special present of big girl underpants. I've tried going in with her and letting her be by herself. Nothing is working! She can recognize that she needs to go, but is so stubborn. When I try to bring her to the potty she runs away, and if I bring the portable potty to her she runs away. She just refuses to cooperate. I'm getting so frustrated. I don't know what else to do. ",1,True,False,False,False,False,False,False,False,False,False,False,False,False,False,False,False,False,False,False,False,False,False,False,False,False,False,False,False,False,False,"I've tried to go in with her and leave her alone. Nothing works! She thinks she needs to go but is so stubborn. As I want to take her to the potty, she runs off and if I take her the wearable potty, she runs off, she just refuses to cooperate. This is frustrating me. I don't know what else to do."
"My toddler is so picky. Like refuses everything. She hates vegetables, eats most fruits but not a lot of meats at all. I have tried everything. She eats what we eat and half the time she refuses to eat. Right now she eats majority of fruits, all pastas, mac and cheese, and that's it for now. I've been at my wits end for months because in baby hood up til maybe 13 months she ate EVERYTHING. Well I bought a pouch like 2 days ago and gave it to her today, and she ate it right up. It was one with carrots, apples and pineapples. She also just finished a blueberry and apple one. I like them but I've read so many downsides to them. Thoughts? \n",1,False,False,False,False,False,False,False,False,False,False,True,False,False,False,False,False,False,False,False,False,False,False,False,False,False,False,False,False,False,False,"My kid is so picky, refuses to eat anything, hates vegetables, eats most fruits but not much meat. I tried everything, we found a way and half the time she refuses to eat anything. Right now she eats most fruits, pasta, macs and cheese and that was it for this time. I have been on the end of my mind for months because she eats Everything in the baby hood until maybe 13 months ago. Well, I bought a bag like 2 days ago, gave it to her today and she ate it until the last minute. It was one with carrots, apples and pineapple. She has also created a package of blueberries and apples. I like her but have read quite a few disadvantages. Thoughts?"
"Hi! I'm looking for boy's clothing size 3t, 6-7, and 12-14. I'm also looking for kid's bedding such as blankets and sheets. I'd appreciate any help! ",1,False,False,False,False,False,False,False,False,False,False,False,False,False,False,False,False,False,False,False,False,False,False,False,True,False,False,False,False,False,False,"Hello! I am looking for boys clothes size 3t, 6-7 and 12-14. I am also looking for cots, blankets and bed linen. I would appreciate any help!"
"My paediatrician suggested we start introducing solids to my 4 month old. I went and bought some rice cereal and then realized, I have no idea what the hell I'm doing. LO hates bottles so I'm really hoping solids go better. Any tips or tricks would be appreciated, thanks!",1,False,False,False,False,False,False,False,False,False,False,True,False,False,False,False,False,False,False,False,False,False,False,False,False,False,False,False,False,False,False,My pediatrician suggested that we start introducing solids into my 4-month-old child. I went there and bought rice muesli and then realized I have no idea what I'm doing. LO hates bottles so I really hope solids work better. Tips or tricks would be welcome.
"We moved across the country for my wife's work and subsequently we don't know anyone.  Where ever I go, parents are just locked onto their phones so its pretty hard to start a conversation.  I'd really like to have my daughter meet other children, and secondarily to just talk to other adults.  I feel like my daughter is missing out on socialization and will quit staying at home to enter her in daycare so she can grow with other children.  Today, I checked meetup.com and while there are dozens and dozens of SAHM groups there aren't any for dads.   As an aside, the mom's groups range from the normal to the hilariously specific like raw diet moms and doomsday prepping moms.  Anyhow, if you're a SAHD how do you make friends?  Do SAHMs think its too weird to have a guy in the moms group? Does it actually work or is the gap between moms and dads too great to overcome?",1,False,False,False,False,False,False,False,False,False,False,False,False,False,False,False,False,False,False,False,False,True,False,False,False,False,False,False,False,False,False,"We traveled across the country for my wife's work and know nobody. Wherever I go, parents are locked onto their phones, so it's quite quite difficult to start a conversation. I would have loved to meet my daughter and secondly to talk to other adults. I feel that my daughter misses socialization, and would give up staying at home to go to a daycare center so she can grow up with other kids. Today I have checked meetup.com, and while there are dozens of SAHM groups, these don't exist for fathers. Incidentally, the mother's groups range from the most normal to the cheerful like Mother and Mom Diet Prep. Anyway, did you know friends? Do you find it somehow too odd to have a guy in the Mom Group?"
"For the last little while (probably a month) there's been an impenetrable, hard, chalky build-up in the bottom of his potty.  To get it off you really have to go at it with like a chisel or something, it's ridiculous.  What could this be?  Is it something in his urine collecting on the plastic?  I wash it out thoroughly at least once a day (after he poops) but sometimes he'll pee on his own and I won't notice for a couple hours so there is sometimes pee sitting in the bowl for a while before I rinse it out.  But even washing with a cloth every day doesn't get it off, it's HARD and really stuck on there unless it flakes off.\n\nAs far as I can tell he has no UTI or anything, his pee isn't cloudy so I have no idea what could be causing this.",1,True,False,False,False,False,False,False,False,False,False,False,False,False,False,False,False,False,False,False,False,False,False,False,False,False,False,False,False,False,False,"A little while now (almost one month) the impenetrable, hard, chalky bottom of his jar has been there. To get it, you have to really pee at it with a chisel or something, it's ridiculous. What could that be? Is there something in the urine on ano plastic? I wash it out thoroughly at least once a day (after he pops), but sometimes he'll pee on his own and I don't notice it for a couple of hours so sometimes he pees in the bowl, until I rinse him. But even daily washing with a cloth doesn't make it, he's hard and gets stuck to it, unless he peels. Kronkorn\ nFrom what I can tell, that he doesn't have UTI or anything, his pee isn't cloudy, so it is hard and it's hard and it's not."
"My son is 4 months old next week and ever since I switched to making formula with the baby brezza he no longer burps after a feed. He just spits up when I try to burp him, and maybe has one tiny burp, but is no longer spitting up frequently after meals. \n\nI\u2019ve weighed the bottles and compared the ones I make by hand and the mixing ratio is the same, so my machine is working fine. I asked his doctor about it at our last appointment and he said if it\u2019s mixing the correct ratio then it\u2019s likely just because there aren\u2019t as many air bubbles trapped in the bottle from shaking it and he just doesn\u2019t have to burp, which is why he spits up instead. He looks perfectly healthy and doesn\u2019t have any concerns.\n\nAnyway, what he said makes sense since when I make his bottles by hand he does still burp quite a bit, but I was wondering if anyone else experienced this?",1,False,True,False,False,False,False,False,False,False,False,False,False,False,True,False,False,False,False,False,False,False,False,False,False,False,False,False,False,False,False,"My son is four months old next week and since I switched to the formula of baby pretzels he doesn't belch for food any more. He spits the saxophone when I tend to belch him, and he may have a little belch, but he doesn't spit out often after eating.\ n\ nI weighed and compared the bottles I hand-mixture over and the mixing ratio is the same, so my gadget works well. I consulted his doctor on our last appointment for this, and he said that if it's the right mixing ratio, it's likely just because there are so many bubbles trapped in the bottle while shaking and he doesn't have to belch, which is why he spits instead. He looks perfectly healthy and has"
"So... Crazy day. OB office cancelled our appointment because they thought we had already had the baby? Not sure how the hell that happens, but they managed to squeeze us in. OB suggested we set an induction date because he doesn't want her going to 42 weeks, so kiddo has until Wednesday night to vacate the premises. Thanks for the stories, pictures and encouragement, gentlemen. Here comes the final stretch!",1,False,False,False,False,False,False,False,False,False,False,False,False,False,False,False,True,False,False,False,False,False,False,False,False,False,False,False,False,False,False,"So... crazy day. The OB office cancelled our appointment because you thought that we had already had the baby? You did not know how the hell it happened but you managed to push us down. The OB van offered to set us a date, because it does not want her to turn 42 weeks old, so Kiddo has until Wednesday evening to vacate the area. Thank you for all the stories, photos and encouragement, gentlemen. Here comes the final leg!"
"I'm new to this subreddit, so I just thought I'd say hi! \n\nAs a general question, what's everyone's favourite &amp; least favourite parts about being stay-at-home parents? And why did you decide to be one?\n\nI'm a 22 year old from Australia, and I have an 18 month old son. He's the best thing that I've ever done with my life! I never really had a career that I loved, being a Mum has been the only thing I've ever really wanted to do with my life. I split with my husband about a year ago so I spend all of my time at home with our son, he takes him for a few hours midweek and one night on the weekend. We still get along extremely well.\n\nThat's about it. Haha. I'd love to hear your stories!",1,False,False,False,False,False,False,False,False,False,False,False,False,True,False,False,False,False,False,False,False,False,False,False,False,False,False,False,False,False,False,"I'm new to this subreddit, so I just thought I'd say hello!\ n\ nI'm 22 years old from Australia and I have an 18-month-old son. It's the best thing I've ever done with my life! I never really had a career I loved, being a mom was the only thing I ever really wanted to do with my life. About a year ago I split from my husband, and so I spend all my time at home with our son, he takes me around for a couple of hours during the week and a night at the weekend.\ n\ nThat's all. Haha. I would love to hear your stories!"
"I'm completely new to this so bear with me! How many shells and how many inserts do you put in your diaper bag? I went with pocket diapers. All the ones I purchased came with 2 inserts a piece. If I put one shell in there, do I put 2 inserts? Will the baby always use 2 inserts or should I just use one during the day? The most important question is how many diapers you put in your bag. 2 shells, 4 inserts? 2 shells 2 inserts? 3 shells, 4...etc. My baby isn't here yet and for right now I'm very lost and confused",1,False,False,False,False,False,False,False,True,False,False,False,False,False,False,False,False,False,False,False,False,False,False,False,False,False,False,False,False,False,False,"I'm new in this area, so carry me! How many shells and how many inserts do you place in your diaper bag? I walked with diaper. Everyone I bought had 2 inserts in one piece. When I put a bowl in, do I put 2 inserts? Does the baby always use 2 inserts or should I use only one each day? The most important question is how many diapers do you have in your pocket. 2 bowls, 4 inserts? 2 bowls, 2 inserts? 3 bowls, 4... etc. My baby is still not here and right now I'm very lost and confused."
"Hi there! We live in the Bay Area and with rent being so expensive, we\u2019ve settled into a studio apartment. It also meets out \u201cminimalism\u201d needs, both of us like little clutter. We are expecting a baby in June, what are the things we NEED for little one?  A few things:\n\n-I\u2019m really, really, really hoping breastfeeding works out for us and I can utilize this option for the first year, nervous though bc I\u2019ll have to go back to work after my 6 week maternity leave runs out.\n-We both use a car to get to work so we will need a car seat, I keep seeing people debate on whether you need a newborn one or not? Can someone elaborate?\n-I hope to \u201cbabywear\u201d often. \n-Wanting a good stroller we can have for years that\u2019s good for jogging, etc. Ok to buy this item used!\n\n",1,False,False,False,False,False,False,False,True,False,False,False,False,False,False,False,False,False,False,False,False,False,False,False,False,False,False,False,False,False,False,"Hello! We live in the Bay Area and rent is so expensive that we have settled into a studio apartment. It also meets the needs of the minimalism, both of us like small clutter. We are expecting a baby in June, what do we need for the little one? A few things:\ n\ n-I\ u2019m really, really hoping that breastfeeding is sufficient for us, and I can use this alternative for the first year although I am nervous, although bc I\ u2019ll need to go to work after my six-week maternity leave ends.\ n-We both drive to work so we need a car seat. Im always seeing people arguing about whether you need a newborn or not?\ n - I hope that this item can be bought frequently.\ n Do we search the"
"FTM and began a new career as a SAHP right after my baby was born. He'll be 6 months this week and still EFB. Lately I've been worried that I've somehow damaged my kid by being a SAHM. He is entertained by other people, but I have to be in sight or he'll have a meltdown after 10-20 minutes. If he's tired or teething he only wants me. This depresses my husband and the stress is wearing on me emotionally &amp; physically at times because he wants to be held so much. I love being with him all the time, but I worry not having him used to being with other people is damaging. Anyone have any experience with the same thing? I guess I'm just looking for words of encouragement. Thanks!",1,False,False,False,False,False,False,False,False,False,False,False,True,False,False,False,False,False,False,False,False,False,False,False,False,False,False,False,False,False,False,"I have been worried lately that I may have damaged my child because it is a SAHM. Other people are entertaining them, but I have to be in view, or Geldstrafe comes after 10-20 minutes. If he is tired or from start to finish he just wants me. It puts a strain on my husband and the stress puts mental and physical strain on me at times, because he wants to become so much. I love to be with him all the time, but don't be afraid to let him get used to living with other people hurt. Who has had any experience about that? I think I am looking for a word of encouragement. Thank you!"
"Help! Has anyone had a toddler who hates baths and has overcome it? My 2.5 year old just screams. She hates being wet so bath time is her worst nightmare. She's never enjoyed bath time, but it used to be bearable when she was smaller.  We've tried a shower (that's worse), new bath toys, music, screen time, stories, bubble bath (she was scared of it!) and probably countless other things. Nothing has helped and it's just such a chore now to bathe her especially as she can now climb out! Any suggestions or tips would be very gratefully received! ",1,False,False,False,False,False,False,False,False,False,False,False,True,False,False,False,False,False,False,False,False,False,False,False,False,False,False,False,False,False,False,"Help! Has anyone had a child who hates baths and defeated him? My 2.5 year old just screams. She hates being wet, so the baths are her worst nightmare. She was never pleased to enjoy the baths, but when she was little, she was bearable. We tried a shower (which is worse), new bath toys, music, movies, stories, bubble bath (she was afraid of it) and probably countless other things. Nothing helped and it is just such a struggle to bathe her now, because she can get out now! All suggestions or tips would be appreciated!"
